{
  "id": "sox",
  "name": "Sarbanes-Oxley Act / PCAOB Standards",
  "shortName": "SOX / PCAOB",
  "description": "SOX Section 404 requires public companies to assess and report on the effectiveness of internal controls over financial reporting (ICFR). The PCAOB standards that govern how auditors test those controls have evolved significantly — from AS 5 (2007) to AS 2201 (the current integrated audit standard) and the landmark QC 1000 quality control standard finalized in 2024.",
  "copyright": "public-domain",
  "showFullText": true,
  "publisher": "PCAOB",
  "source": "https://pcaobus.org/Standards",
  "officialChangelogUrl": "https://pcaobus.org/Standards/Auditing",
  "lastDataUpdate": "2026-07-12",
  "versions": [
    "AS 5 (2007)",
    "AS 2201 (2010)",
    "QC 1000 (2024)"
  ],
  "latestVersion": "QC 1000 (2024)",
  "transitions": {
    "AS5-to-AS2201": {
      "fromVersion": "AS 5 (2007)",
      "toVersion": "AS 2201 (2010)",
      "fromReleaseDate": "2007-06-12",
      "toReleaseDate": "2010-06-01",
      "summary": {
        "added": 8,
        "removed": 3,
        "modified": 14,
        "restructured": 5,
        "totalFrom": 89,
        "totalTo": 94,
        "highlights": [
          "AS 5 renumbered and reorganized into AS 2201 as part of PCAOB's broader standards codification project — content substantially preserved but reorganized for clarity",
          "Top-down, risk-based approach to ICFR auditing reinforced — auditors must explicitly focus testing on areas of greatest risk of material misstatement",
          "Entity-level controls (ELCs) given greater emphasis — strong ELCs can reduce the extent of testing needed at the transaction level",
          "Fraud risk assessment integrated more explicitly — auditors must evaluate whether identified control deficiencies increase fraud risk",
          "Guidance on evaluating IT general controls (ITGCs) and IT application controls clarified — including when IT controls can substitute for manual controls",
          "Scaling guidance for smaller, less complex companies formalized — proportionate audit approach explicitly endorsed"
        ]
      },
      "changes": [
        {
          "id": "change-sox-as5-as2201-001",
          "type": "restructured",
          "category": "codification",
          "controlId": {
            "old": "AS 5",
            "new": "AS 2201"
          },
          "title": "AS 5 renumbered to AS 2201 as part of PCAOB standards codification",
          "area": "Framework — Structure",
          "oldText": "Auditing Standard No. 5 — An Audit of Internal Control Over Financial Reporting That Is Integrated with An Audit of Financial Statements.",
          "newText": "AS 2201 — An Audit of Internal Control Over Financial Reporting That Is Integrated with An Audit of Financial Statements. Effective for audits of fiscal years ending on or after June 1, 2010.",
          "rationale": "PCAOB reorganized its entire standards library into a numbered codification system (AS 1000–3000 series) to improve navigation and consistency. AS 5 became AS 2201, placed in the 2000-series covering audit procedures. The content was substantively preserved but reorganized to fit the new structure and cross-reference system.",
          "significance": "medium",
          "tags": [
            "codification",
            "renumbering",
            "restructured",
            "as-2201"
          ]
        },
        {
          "id": "change-sox-as5-as2201-002",
          "type": "modified",
          "category": "risk-based-approach",
          "controlId": {
            "old": "AS 5 ¶20",
            "new": "AS 2201 ¶12"
          },
          "title": "Top-down risk-based approach requirements strengthened",
          "area": "AS 2201 — Audit Approach",
          "oldText": "The auditor should use a top-down approach to the audit of internal control over financial reporting to select the controls to test. The auditor begins at the financial statement level and with the auditor's understanding of the overall risks to internal control over financial reporting.",
          "newText": "The auditor must use a top-down approach to the audit of internal control over financial reporting. The auditor begins at the financial statement level and uses the understanding of overall risks to ICFR to identify significant accounts and disclosures and their relevant assertions. This approach directs the auditor's attention to those controls that most affect the risk of material misstatement in the financial statements and helps the auditor avoid excessive testing of controls that, even if deficient, would not present a reasonable possibility of material misstatement.",
          "rationale": "AS 2201 strengthened the language around the top-down risk-based approach from 'should' to 'must' and added explicit language about avoiding excessive testing. This responded to criticism that AS 5 audits were still too expansive and costly, particularly for smaller issuers. The clarification that the goal is to identify the controls most affecting material misstatement risk — not to test all controls — was significant for scoping efficiency.",
          "significance": "high",
          "tags": [
            "risk-based",
            "top-down",
            "scoping",
            "material-misstatement",
            "efficiency"
          ]
        },
        {
          "id": "change-sox-as5-as2201-003",
          "type": "modified",
          "category": "entity-level-controls",
          "controlId": {
            "old": "AS 5 ¶22-24",
            "new": "AS 2201 ¶14-17"
          },
          "title": "Entity-level controls given greater weight in reducing transaction-level testing",
          "area": "AS 2201 — Entity-Level Controls",
          "oldText": "The auditor should evaluate entity-level controls, which can have a pervasive effect on the company's internal control over financial reporting. Some entity-level controls might be designed to operate at a level of precision that would adequately address the risk that a misstatement of a relevant assertion would be prevented or detected on a timely basis.",
          "newText": "Entity-level controls that are precise enough to, by themselves, adequately address the risk that a material misstatement of a relevant assertion might occur allow the auditor to reduce or eliminate testing of other controls. The auditor must evaluate whether individual entity-level controls are sufficiently precise to address a given risk and, if so, may limit testing of other controls related to that risk.",
          "rationale": "AS 2201 made explicit what was only implied in AS 5: strong entity-level controls (particularly the control environment, risk assessment processes, and monitoring controls) can substitute for detailed transaction-level testing. This was a meaningful change for companies with mature control environments — allowing auditors to rely more on ELCs and reduce the overall scope of substantive transaction-level testing.",
          "significance": "high",
          "tags": [
            "entity-level-controls",
            "elc",
            "testing-scope",
            "control-environment",
            "efficiency"
          ]
        },
        {
          "id": "change-sox-as5-as2201-004",
          "type": "modified",
          "category": "it-controls",
          "controlId": {
            "old": "AS 5 ¶42-46",
            "new": "AS 2201 ¶26-28"
          },
          "title": "IT general controls and application controls guidance clarified",
          "area": "AS 2201 — IT Controls",
          "oldText": "The auditor should obtain an understanding of how IT affects the company's flow of transactions and the risks arising from IT. Automated controls may require testing of the ITGC environment to support reliance on those automated controls.",
          "newText": "When an automated control is effective and the IT general controls supporting that automated control are effective, the auditor may be able to reduce the extent of testing of the automated control based on its consistency and automated nature. The auditor must evaluate which IT general controls are relevant to the automated controls being tested and must test those ITGCs to support reliance on the automated controls. Highly automated processing environments with effective ITGCs may allow reduced transaction-level testing.",
          "rationale": "The relationship between ITGCs and automated application controls was a source of significant confusion under AS 5. AS 2201 clarified that effective ITGCs support reliance on automated controls (because automated controls execute consistently), which in turn can reduce manual transaction testing. This was significant for technology-intensive companies where automation is pervasive.",
          "significance": "high",
          "tags": [
            "itgc",
            "it-controls",
            "automated-controls",
            "application-controls",
            "technology"
          ]
        },
        {
          "id": "change-sox-as5-as2201-005",
          "type": "modified",
          "category": "deficiency-evaluation",
          "controlId": {
            "old": "AS 5 ¶62-70",
            "new": "AS 2201 ¶62-70"
          },
          "title": "Control deficiency evaluation framework — severity classification clarified",
          "area": "AS 2201 — Deficiency Evaluation",